ID,HashTags,Time,TweetText,Outputs,URL,User,Randomize
195,"Obamacare, TrumpCare",2017-05-04 20:29:13,Same people against  R the main ones that need it🤔cuz  is 4 the rich &amp; uninjured &amp; U ain't Rich 😂 ,Same people against  R the main ones that need it🤔cuz  is 4 the rich &amp; uninjured &amp; U ain't Rich 😂 ,https://twitter.com/i/web/status/860229852833644545,End_Prejudice,6680
196,AHCA,2017-05-04 20:29:14,Hey @theobserver do you have a list of the NC and SC house representatives' vote on ?,Hey @theobserver do you have a list of the NC and SC house representatives' vote on ?,,karlacrz,7032
197,"StarWarsDay, DarkSide, TheForce, Congress, AHCA",2017-05-04 20:29:15,Since its . it certainly feels like the  of  aka  came after older Americans w/ the  bill.,Since its . it certainly feels like the  of  aka  came after older Americans w/ the  bill.,,t_jh2009,6858
198,AHCA,2017-05-04 20:29:16,"We lost our voice, our rights, control of our bodies, &amp; now our healthcare. Trump has destroyed our country with a smile on his face. ","We lost our voice, our rights, control of our bodies, &amp; now our healthcare. Trump has destroyed our country with a smile on his face. ",,AngelaDawn623,6921
199,AHCA,2017-05-04 20:29:17,Is their a way to see a non-partisan comparison between  Obamacare and  without the atomic OMAGAW DIS A OUTRAGE RABBLE RABBLE RABBLE,Is their a way to see a non-partisan comparison between  Obamacare and  without the atomic OMAGAW DIS A OUTRAGE RABBLE RABBLE RABBLE,,DavidSchulte1,6944
200,AHCA,2017-05-04 20:29:17,"Are you drinking up, @RobWittman? Celebrate now, we are watching and we are angry.  ","Are you drinking up, @RobWittman? Celebrate now, we are watching and we are angry.  ",https://twitter.com/theavclub/status/860229061603471360,AltPeapup,7204
201,,2017-05-04 20:29:18,"@realDonaldTrump You're all going to be unpleasantly surprised over the next few years, you worthless, amoral sociopaths    ","@realDonaldTrump You're all going to be unpleasantly surprised over the next few years, you worthless, amoral sociopaths    ",https://twitter.com/i/web/status/860229871242551296,BostinPat,7097
202,ahca,2017-05-04 20:29:18,".@HouseGOP who voted Yes for today's healthcare revisions, prepare to be revised out of your seat in 2018.  You are despicable. ",".@HouseGOP who voted Yes for today's healthcare revisions, prepare to be revised out of your seat in 2018.  You are despicable. ",,husky_rascal,6780
203,AHCA,2017-05-04 20:29:21,"Stop calling this . It is now Trumpcare, a disgusting bill that protects the rich and let the poor to die without proper coverage","Stop calling this . It is now Trumpcare, a disgusting bill that protects the rich and let the poor to die without proper coverage",,scarlletbitch,7087
204,,2017-05-04 20:29:21,When you're so mad you could just literally cry ,When you're so mad you could just literally cry ,https://twitter.com/shannonrwatts/status/860216330120814592,AlexandriaRae_,7173
205,"Obamacare, Trumpcare, FuckTrump, AHCA, StopTrump, Resist",2017-05-04 20:29:21," wasn't broke, it didn't need to be fixed❗   is NO CARE‼️ 🤥  🛑 👊"," wasn't broke, it didn't need to be fixed❗   is NO CARE‼️ 🤥  🛑 👊",https://www.nytimes.com/2017/05/03/opinion/trump-health-care.html,SimplySue777,6742
206,,2017-05-04 20:29:24,At this point..we tried to save those in red states.. they refused.. so they will deal with the consequences. Can't wait for the CBO score. ,At this point..we tried to save those in red states.. they refused.. so they will deal with the consequences. Can't wait for the CBO score. ,https://twitter.com/i/web/status/860229896110395392,TrumpanzeeSaid,7119
207,"AHCA, VoteNoAHCA",2017-05-04 20:29:24,"Dear @tedcruz, if  is so great, Why is the @AmerMedicalAssn against it? Do you think you will survive a yes vote? ","Dear @tedcruz, if  is so great, Why is the @AmerMedicalAssn against it? Do you think you will survive a yes vote? ",,Jamie_Zapata_,6705
208,"ahca, gopkillspeople, thegop",2017-05-04 20:29:27,"We will ALL HAVE TO ANSWER TO GOD, EVEN YOU @realDonaldTrump 
&amp; you won't have $$ to protect you then!
   is evil","We will ALL HAVE TO ANSWER TO GOD, EVEN YOU @realDonaldTrump 
&amp; you won't have $$ to protect you then!
   is evil",,blissful1985,7074
209,AHCA,2017-05-04 20:29:26,"Again, USA:

If your Rep voted for , call them on it.
If your Rep voted against it, thank them.

And tell the Senate to . ","Again, USA:

If your Rep voted for , call them on it.
If your Rep voted against it, thank them.

And tell the Senate to . ",https://twitter.com/i/web/status/860229907871399936,michael_w_busch,7136
210,"TrumpDontCare, AHCA, resist",2017-05-04 20:29:27,Vote these inhumane people out of office    ,Vote these inhumane people out of office    ,https://twitter.com/xafferty/status/860224460829466624,WoolPearls,6979
211,"AHCA, shame, trumpcare",2017-05-04 20:29:27,This is insane. It's a law condemning women and poor people.    ,This is insane. It's a law condemning women and poor people.    ,https://twitter.com/nymag/status/860135970540224515,clrthrn,6873
212,"TrumpCare, AHCA",2017-05-04 20:29:33,".@RepMcSally,

Screw you!

You sentenced innocent folks to death! You are the death panel!

You will hear us!

 ",".@RepMcSally,

Screw you!

You sentenced innocent folks to death! You are the death panel!

You will hear us!

 ",,SujOfficial,6794
213,"TheResistance, Obamacare",2017-05-04 19:53:24,"WE The People are watching! The GOP &amp; 2 DEMS who voted against our healthcare, MUST GO!  … ","WE The People are watching! The GOP &amp; 2 DEMS who voted against our healthcare, MUST GO!  … ",,therealezway,7091
214,,2017-05-04 20:29:36,California's House Republicans are crucial to the healthcare vote. More than half are undecided ,California's House Republicans are crucial to the healthcare vote. More than half are undecided ,http://www.latimes.com/politics/la-pol-ca-ahca-gop-delegation-20170502-htmlstory.html,jane_long,6985
215,,2017-05-04 20:29:36,@JoeNBC So...begin to work with the Senate on Obamacare repeal or throw a party to celebrate the House vote?  Answer is obvious. ,@JoeNBC So...begin to work with the Senate on Obamacare repeal or throw a party to celebrate the House vote?  Answer is obvious. ,https://twitter.com/i/web/status/860229947327229954,TheKrothRoads,6839
216,Obamacare,2017-05-04 20:29:39,"tfw you're rich and your party will condemn thousands of people to die prematurely to make you richer
 ","tfw you're rich and your party will condemn thousands of people to die prematurely to make you richer
 ",,KennedyConnolly,6671
217,"FakePOTUS, Obamacare",2017-05-04 20:29:42,"At Rose Garden after a win he boasts, ""I'm not a politician, how my doin' not too bad hah, I'm President, right!""  ","At Rose Garden after a win he boasts, ""I'm not a politician, how my doin' not too bad hah, I'm President, right!""  ",,es4ideas,6772
218,"GOP, TrumpRussia",2017-05-04 20:29:42,"In other words the: has approved &amp; is promoting Authoritarian Kleptocracy.. Independent  investigation NOW.

 ","In other words the: has approved &amp; is promoting Authoritarian Kleptocracy.. Independent  investigation NOW.

 ",https://twitter.com/i/web/status/860229973881368576,AgentScully2017,6896
219,,2017-05-04 20:29:44,"Somehow I bet erectile dysfunction isn't considered a pre-existing condition. Love to pay for their boners, lucky us. Mmmerica. ","Somehow I bet erectile dysfunction isn't considered a pre-existing condition. Love to pay for their boners, lucky us. Mmmerica. ",https://twitter.com/i/web/status/860229980776693761,elizmayerle,6751
220,"AHCA, Obamacare",2017-05-04 20:29:49,"How Obamacare Fails People With Pre-existing Conditions 
  Affordable Care Act
","How Obamacare Fails People With Pre-existing Conditions 
  Affordable Care Act
",https://www.usnews.com/opinion/policy-dose/articles/2017-05-02/how-obamacare-fails-people-with-pre-existing-conditions?src=usn_tw,IsabelaRM1,6768
221,ObamaCare,2017-05-04 20:29:54, repeal HR are rushing to a vote contains an exemption for members of Congress &amp; staff from losing benefits that bill eliminates., repeal HR are rushing to a vote contains an exemption for members of Congress &amp; staff from losing benefits that bill eliminates.,,LaraLMek,7138
222,AHCA,2017-05-04 20:29:54,"Retweeted Jim Clyburn SC-06 (@ClyburnSC06):

The  will have such an egregious and inhumane impact on... ","Retweeted Jim Clyburn SC-06 (@ClyburnSC06):

The  will have such an egregious and inhumane impact on... ",http://fb.me/1vfzqsFBp,Senecaangel,7215
223,,2017-05-04 20:29:55,". @PAAttorneyGen will you join him, please? With love- a resident of Pa. ",". @PAAttorneyGen will you join him, please? With love- a resident of Pa. ",https://twitter.com/agschneiderman/status/860229551619801088,JanetteKirchner,7199
224,,2017-05-04 20:29:56,Look at the shit-eating grin on this disgusting worm who voted today to destroy the lives of hundreds of thousands of his constituents. ,Look at the shit-eating grin on this disgusting worm who voted today to destroy the lives of hundreds of thousands of his constituents. ,https://twitter.com/i/web/status/860230032987312128,up_in_the_Jer,7153
225,AHCA,2017-05-04 20:29:57,"I never really loved the expression, but @CharlesPPierce just went all types of masshole on the  and he might just have a point ","I never really loved the expression, but @CharlesPPierce just went all types of masshole on the  and he might just have a point ",https://twitter.com/i/web/status/860230033922809856,Pat_Beaudry,6754
226,"Obamacare, AHCA",2017-05-04 20:30:00,"20 Republican House Members Voted Against the Healthcare Bill 
  
 ","20 Republican House Members Voted Against the Healthcare Bill 
  
 ",http://buff.ly/2qF0Zbj,ProjRepubic,7012
227,,2017-05-04 20:30:01,Shame! ,Shame! ,https://twitter.com/BraddJaffy/status/860204878903332864,Treecy_WildTale,7180
228,"AHCA, shameonyou, preexistingconditions",2017-05-04 20:30:01, how much of this has to do with the American people and their lives vs. Getting revenge on Obama  , how much of this has to do with the American people and their lives vs. Getting revenge on Obama  ,,mummadi123,6812
229,,2017-05-04 20:30:01,"Of course. This was always going to happen. Will go to conference, and the Senate will make the House vote up or down on theirs. ","Of course. This was always going to happen. Will go to conference, and the Senate will make the House vote up or down on theirs. ",https://twitter.com/i/web/status/860230052629401600,kwcollins,6849
230,AHCA,2017-05-04 20:30:05,I'M TRYING TO REMAIN CALM BUT HOW CAN I REMAIN CALM WHEN SOME OF MY PREEEXISTING CONDITIONS AREN'T COVERED? ,I'M TRYING TO REMAIN CALM BUT HOW CAN I REMAIN CALM WHEN SOME OF MY PREEEXISTING CONDITIONS AREN'T COVERED? ,,delreyxhemmings,6758
231,,2017-05-04 20:30:06,These 24 House Republicans voted for Trumpcare in seats where Trump got less tha..  ,These 24 House Republicans voted for Trumpcare in seats where Trump got less tha..  ,http://bit.ly/2qET9hY,365TopNews,7155
232,,2017-05-04 20:30:07,House Republicans pass bill to replace and repeal Obamacare - CNN: CNN House Republicans pass bill to replace…  ,House Republicans pass bill to replace and repeal Obamacare - CNN: CNN House Republicans pass bill to replace…  ,https://twitter.com/i/web/status/860230075832086529,DoyleGlobal,6973
233,,2017-05-04 20:30:10,"Only (R) rep in Arizona to vote no. For the wrong reasons, but I'll take it ","Only (R) rep in Arizona to vote no. For the wrong reasons, but I'll take it ",https://twitter.com/repandybiggsaz/status/860222105375449092,AmberKinion,7088
234,"AHCA, WA5",2017-05-04 20:30:10,"@cathymcmorris thanks MoRo, yor a peach.  . You need to be repealed and replaced. 
 @votebenstuckart ","@cathymcmorris thanks MoRo, yor a peach.  . You need to be repealed and replaced. 
 @votebenstuckart ",,JenD1974,6877
235,"AHCA, midterms2018",2017-05-04 20:30:13,The  will not serve those Americans with pre-existing conditions. Don't B fooled. ,The  will not serve those Americans with pre-existing conditions. Don't B fooled. ,,turtledoveictus,7209
236,"Obamacare, AHCA",2017-05-04 20:30:16,"Does this mean that I can no longer thumb my nose at  and ignore the mandate? Darn, I love shafting government. ","Does this mean that I can no longer thumb my nose at  and ignore the mandate? Darn, I love shafting government. ",,historiarex,7134
237,obamacare,2017-05-04 20:30:17,Do u agree w/ what The House did 2  today? Answer here:  @FrankieDarcell @LesterHoltNBC @NBCNightlyNews,Do u agree w/ what The House did 2  today? Answer here:  @FrankieDarcell @LesterHoltNBC @NBCNightlyNews,http://wdasfm.iheart.com/onair/frankie-darcell-50780/obamacare-almost-gone-15802321/,wdasfm,7056
238,"TrumpCare, AHCA, plutocrats, GlobalNonLeadership",2017-05-04 20:30:20,"It all trickles down here, Richie!
    ","It all trickles down here, Richie!
    ",,quixotequest,7015
239,,2017-05-04 20:30:22,When they go low... ,When they go low... ,https://twitter.com/jimsciutto/status/860198495650795520,urbnlibertarian,6955
240,AHCA,2017-05-04 20:30:22,My statement on how today's House vote on the  and will hurt America's kids. ,My statement on how today's House vote on the  and will hurt America's kids. ,https://www.commonsensemedia.org/about-us/news/press-releases/common-sense-kids-action-responds-to-house-vote-on-health-care-bill,jimsteyer,6994
241,"saveaca, ahca",2017-05-04 20:30:24,"donate here to support @mikelevinca fight for the 307k californians rep. issa betrayed today.


 ","donate here to support @mikelevinca fight for the 307k californians rep. issa betrayed today.


 ",https://twitter.com/i/web/status/860230149962219521,iamtimothydavis,6791
242,,2017-05-04 20:30:25,"Wow. The house actually did it. JFC. 

Here’s to hoping this dies in the senate and this vote costs Republicans both chambers.","Wow. The house actually did it. JFC. 

Here’s to hoping this dies in the senate and this vote costs Republicans both chambers.",,ojapa,6860
243,,2017-05-04 20:30:25,"If you're like me, a fortunate Canadian with access to healthcare, please consider channeling your anger and donating to @PPact ","If you're like me, a fortunate Canadian with access to healthcare, please consider channeling your anger and donating to @PPact ",https://twitter.com/i/web/status/860230153191993344,rachellmblair,7167
244,"AHCA, Tcot, trumptrain, MAGA",2017-05-04 20:30:27,"Nothing SWEETER than Liberal tears! Today we are DROWNING in them. THANK YOU Republicans for passing the  !! 
  ","Nothing SWEETER than Liberal tears! Today we are DROWNING in them. THANK YOU Republicans for passing the  !! 
  ",,CSteven,6699
245,,2017-05-04 20:30:28,House Republicans were asked to walk the plank on Trumpcare and they did. Hello 2018 ,House Republicans were asked to walk the plank on Trumpcare and they did. Hello 2018 ,http://www.dailykos.com/story/2017/5/4/1658859/-House-Republicans-were-asked-to-walk-the-plank-on-Trumpcare-and-they-did-Hello-2018,Resistanceraven,6869
246,,2017-05-04 20:30:30,I can't wait to see @MSNBC's coverage of these upcoming town halls. These GOPers are about to get slammed for this  vote! ,I can't wait to see @MSNBC's coverage of these upcoming town halls. These GOPers are about to get slammed for this  vote! ,https://twitter.com/i/web/status/860230173475692544,MarineOneJacob,6738
247,"AHCA, Trumpcare, Obamacare",2017-05-04 20:30:32,SHAME on evry single republican who voted for this disaster   - just to repeal  U guys are the worst. pathetic ppl.,SHAME on evry single republican who voted for this disaster   - just to repeal  U guys are the worst. pathetic ppl.,,lynxmc1,7214
248,AHCA,2017-05-04 20:30:33,The GOP house Republicans passed the  against the will of the American people who when last polled said about 17% supported this bill.,The GOP house Republicans passed the  against the will of the American people who when last polled said about 17% supported this bill.,,EvilGary101,6692
249,America,2017-05-04 20:30:38,So take away from the poor to give a tax cut to the rich? You got to be 💩 me.  you want this? fight bsck✊🏼 ,So take away from the poor to give a tax cut to the rich? You got to be 💩 me.  you want this? fight bsck✊🏼 ,https://twitter.com/nicholsuprising/status/860197511289503744,GabbyQuinteros,6836
250,AHCA,2017-05-04 20:30:39,"A sexual assault offender can become President, but a sexual assault victim cannot get healthcare.   ","A sexual assault offender can become President, but a sexual assault victim cannot get healthcare.   ",,LouLachat,6847
251,,2017-05-04 20:30:40,"The House passed this Horrible Health Bill, . Republicans have committed Political Suicide.","The House passed this Horrible Health Bill, . Republicans have committed Political Suicide.",,OFFTOMARS11531,6845
252,,2017-05-04 20:30:43,My father in law got cancer treatment due to Obamacare ,My father in law got cancer treatment due to Obamacare ,https://twitter.com/funder/status/859921168752668673,heardatwork123,6719
253,SaveTheACA,2017-05-04 20:30:45,"Dear House Republicans, Have a nice tax-payer funded 11 day break. We know where you live  ","Dear House Republicans, Have a nice tax-payer funded 11 day break. We know where you live  ",,eqracer,6916
254,AHCA,2017-05-04 20:30:48,"Current Mood: The Heart Is A Lonely Hunter.
 ","Current Mood: The Heart Is A Lonely Hunter.
 ",,Breznican,6813
255,"GOP, AHCA",2017-05-04 20:30:49,Definitely waste no time in calling your Senators.  needs to hear passing  will definitely have political repercussions  ,Definitely waste no time in calling your Senators.  needs to hear passing  will definitely have political repercussions  ,https://twitter.com/i/web/status/860230252244553728,IndivisibleLuma,7071
256,AHCA,2017-05-04 20:30:51,I honestly feel sick over this. Does that mean I have another pre-existing contusion to add to my list?  ,I honestly feel sick over this. Does that mean I have another pre-existing contusion to add to my list?  ,,RowlandJordyn,7158
257,,2017-05-04 20:30:51,@SenateMajLdr @SpeakerRyan @HouseGOP @SenateGOP @POTUS Fuck you all. God won't let you get away with hurting so many people over healthcare ,@SenateMajLdr @SpeakerRyan @HouseGOP @SenateGOP @POTUS Fuck you all. God won't let you get away with hurting so many people over healthcare ,https://twitter.com/i/web/status/860230263313506307,melinda_lu18,7208
258,AHCA,2017-05-04 20:30:54,"Anyone trademarked Trump Coffins yet?

","Anyone trademarked Trump Coffins yet?

",,HITEXECUTIVE,6773
259,"FireKenBuck, FireScottTipton, FireDougLamborn",2017-05-04 20:30:55,  . They just voted to let Coloradans die. ,  . They just voted to let Coloradans die. ,https://twitter.com/marshallzsays/status/860198257603096577,Lula6288,6864
260,,2017-05-04 18:19:35,"This celebratory atmosphere over stripping health care from the sick is one of the most obscene political spectacles I've witnessed. 
","This celebratory atmosphere over stripping health care from the sick is one of the most obscene political spectacles I've witnessed. 
",,HANAtruly,6945
261,,2017-05-04 20:31:02,@HouseGOP What happens when u sentence a constituent to death and then approve gun purchases for nut jobs? Wait for it. Wait.   ,@HouseGOP What happens when u sentence a constituent to death and then approve gun purchases for nut jobs? Wait for it. Wait.   ,https://twitter.com/i/web/status/860230307546640388,Gr82BUs,6807
262,"BREAKING, trumprussia, russiagate, resist, obamacare",2017-05-04 20:31:06,"""@funder: : House Passes Bill That Will Never Become Law

   ""

LET US HOPE THIS IS TRUE","""@funder: : House Passes Bill That Will Never Become Law

   ""

LET US HOPE THIS IS TRUE",,kayemclaren2,7058
263,,2017-05-04 20:31:07,Way to get 'em is through the courts ,Way to get 'em is through the courts ,https://twitter.com/AGSchneiderman/status/860229551619801088,GWfashionista,6980
264,,2017-05-04 20:31:07,"Cali,  7 dem seats as good as ours in 2018. Donate, call, knock on doors. START TODAY. Issa et al effectively signed their resignations. ","Cali,  7 dem seats as good as ours in 2018. Donate, call, knock on doors. START TODAY. Issa et al effectively signed their resignations. ",https://twitter.com/i/web/status/860230330044661762,kidsistah,7042
265,,2017-05-04 20:31:08,The sad part is ...these voters will pay dearly ,The sad part is ...these voters will pay dearly ,https://twitter.com/dailykos/status/860225901816139776,Hollyberry872,6732
266,,2017-05-04 20:31:10,House Republicans just voted for a healthcare bill that the CBO didn't even have time to score yet.,House Republicans just voted for a healthcare bill that the CBO didn't even have time to score yet.,,KimAcheson,6824
267,,2017-05-04 20:31:11,“Millions of Americans are about to lose health care coverage @GOP are drinking beer”: Dems slam @HouseGOP ,“Millions of Americans are about to lose health care coverage @GOP are drinking beer”: Dems slam @HouseGOP ,http://www.salon.com/2017/05/04/millions-of-americans-are-about-to-lose-health-care-coverage-and-the-republicans-are-drinking-beer-democrats-slam-house-gop-after-passage-of-trumpcare/#.WQuPYwDUtLQ.twitter,TheRReport,6871
268,,2017-05-04 20:31:22,"WATCH: Democrats Taunt House Republicans After Trumpcare Vote, Sing 'Na Na Na Na, Hey, Goodbye'

Decorum Abounds ","WATCH: Democrats Taunt House Republicans After Trumpcare Vote, Sing 'Na Na Na Na, Hey, Goodbye'

Decorum Abounds ",http://www.dailywire.com/news/16080/watch-democrats-taunt-house-republicans-after-robert-kraychik,shanandcrew,7022
269,TrumpCare,2017-05-04 20:31:23," is not only cruel and callous.

It's also unconstitutional.

And @AGSchneiderman is on it. "," is not only cruel and callous.

It's also unconstitutional.

And @AGSchneiderman is on it. ",https://twitter.com/AGSchneiderman/status/860229551619801088,djlavoie,6882
270,AHCA,2017-05-04 20:31:25,"Properly articulating my feelings about  is hard, but I do have two things to say: 
1. Fuck you @HouseGOP
2. Super fuck you @PRyan","Properly articulating my feelings about  is hard, but I do have two things to say: 
1. Fuck you @HouseGOP
2. Super fuck you @PRyan",,MrsJoeBiden,7048
271,,2017-05-04 20:31:27,".@realDonaldTrump First, House Republicans are trying to effectively deny access to reproductive health services—a… ",".@realDonaldTrump First, House Republicans are trying to effectively deny access to reproductive health services—a… ",https://twitter.com/i/web/status/860230412869582848,AGSchneiderman,7179
272,,2017-05-04 20:31:29,House Republicans pass healthcare bill in first step toward replacing Obamacare  ,House Republicans pass healthcare bill in first step toward replacing Obamacare  ,http://www.rightrelevance.com/search/articles/hero?article=8f2d9a743e1badf057cc3c6c9e91bfaa090672f3&query=Bioethics&taccount=bioethicsrr,BioethicsRR,7054
273,,2017-05-04 20:31:30,"@KamalaHarris I have no doubt you oppose this, but I urge you to make the impact clear and I will stand beside you in this fight. ","@KamalaHarris I have no doubt you oppose this, but I urge you to make the impact clear and I will stand beside you in this fight. ",https://twitter.com/i/web/status/860230426220036096,YogicAmnesiac,6859
274,AHCA,2017-05-04 20:31:32,If you voted for trump thinking you were different from the rest. That he would look out for you. Today proves you are wrong. ,If you voted for trump thinking you were different from the rest. That he would look out for you. Today proves you are wrong. ,,beautifullynerd,6752
275,,2017-05-04 20:31:33,Doom in their career in politics &amp; beyond. ,Doom in their career in politics &amp; beyond. ,https://twitter.com/thehill/status/860228058292334593,LaMinang,6953
276,"AHCA, Trumpcare",2017-05-04 20:31:35,This whole  thing makes my head hurt &amp; pressure go up. One way or another @HouseGOP wants me to die. Heartless bastards. ,This whole  thing makes my head hurt &amp; pressure go up. One way or another @HouseGOP wants me to die. Heartless bastards. ,,nikkiyo,7166
277,,2017-05-04 20:31:37,What a disgrace. ,What a disgrace. ,https://twitter.com/thehill/status/860197295995932672,hipsterhobos,7035
278,,2017-05-04 20:31:38,"I don't know why we would expect her to. This notion that Ivanka is a ""Voice of reason"" is a Centrist delusion. ","I don't know why we would expect her to. This notion that Ivanka is a ""Voice of reason"" is a Centrist delusion. ",https://twitter.com/activist360/status/860228874910748672,RealChrisCutts,6863
279,AHCA,2017-05-04 20:31:42,. How much did the taxpayers pay for their celebration?  What asses!!!,. How much did the taxpayers pay for their celebration?  What asses!!!,,hossp63,6829
280,"AZ, GOP, ACA",2017-05-04 20:31:44,Andy Biggs was sole  Congressional  House member to vote against  repeal ,Andy Biggs was sole  Congressional  House member to vote against  repeal ,https://twitter.com/mviser/status/860198098433454080,SusanHowardSXSW,6757
281,"Obamacare, TrumpCare",2017-05-04 20:31:45,Same people against  R the main ones that need it🤔cuz  is 4 the rich &amp; uninjured &amp; U aint Rich😂   ,Same people against  R the main ones that need it🤔cuz  is 4 the rich &amp; uninjured &amp; U aint Rich😂   ,https://twitter.com/i/web/status/860230488618872832,End_Prejudice,7061
282,AHCA,2017-05-04 20:31:48,Today is an absolutely sad day for America. I'm at a loss of words because I'll definitely lose my health insurance now. ,Today is an absolutely sad day for America. I'm at a loss of words because I'll definitely lose my health insurance now. ,,RyanJKaz,6712
283,AHCA,2017-05-04 20:31:51,"""Oh wow, thanks for visiting-"" ""Actually, Lord Vader says you can't stay here."" *pulls out of bed*   ","""Oh wow, thanks for visiting-"" ""Actually, Lord Vader says you can't stay here."" *pulls out of bed*   ",https://twitter.com/i/web/status/860230514287853568,JuniperNichols,6761
